{
  "version": 1,
  "status": "candidate_only",
  "reviewed_at": "2026-09-07",
  "inventory_scope": {
    "include": [
      "*"
    ],
    "exclude": [
      ".git/**",
      "__pycache__/**",
      "*.pyc",
      ".pytest_cache/**",
      ".mypy_cache/**",
      ".ruff_cache/**",
      "work/**",
      ".venv/**",
      "venv/**",
      "venv-*/**",
      "**/venv-*/**",
      "**/__pycache__/**",
      "**/node_modules/**",
      "node_modules/**",
      "**/.pytest_cache/**",
      "**/.venv/**"
    ],
    "minimum_classification_coverage": 0.98
  },
  "fact_families": [
    {
      "id": "project_goal_and_kgi",
      "description": "North Star Goal, KGI, Key Factors, phase gates and strategic measurement semantics",
      "canonical_path": "knowledge/project/success-model.md",
      "human_projection_paths": [
        "knowledge/project/goal.md"
      ],
      "classification_patterns": [
        "knowledge/project/*"
      ],
      "freshness": {
        "mode": "manual",
        "max_age_days": null,
        "severity": "info"
      },
      "owner_role": "AI-CHIEF",
      "required_provenance": [
        "human intent",
        "measurement evidence",
        "promotion decision for target changes"
      ]
    },
    {
      "id": "current_public_state",
      "description": "What is actually published, verified, live, blocked, or not yet proven",
      "canonical_path": "STATUS.md",
      "human_projection_paths": [
        "README.md"
      ],
      "classification_patterns": [
        "STATUS.md"
      ],
      "freshness": {
        "mode": "date_line",
        "prefix": "Updated:",
        "max_age_days": 14,
        "severity": "warning"
      },
      "owner_role": "AI-AUDITOR",
      "required_provenance": [
        "commit/revision",
        "test or runtime evidence",
        "explicit claim boundary"
      ]
    },
    {
      "id": "public_beta_execution_sequence",
      "description": "Public Beta-oriented implementation and gate sequence",
      "canonical_path": "ROADMAP.md",
      "human_projection_paths": [],
      "classification_patterns": [
        "ROADMAP.md"
      ],
      "freshness": {
        "mode": "manual",
        "max_age_days": null,
        "severity": "info"
      },
      "owner_role": "AI-CHIEF",
      "required_provenance": [
        "status evidence",
        "dependency order"
      ]
    },
    {
      "id": "public_orientation",
      "description": "Reader-facing system map and project orientation; not the canonical live-status owner",
      "canonical_path": "README.md",
      "human_projection_paths": [],
      "classification_patterns": [
        "README.md",
        "README.en.md"
      ],
      "freshness": {
        "mode": "manual",
        "max_age_days": null,
        "severity": "info"
      },
      "owner_role": "AI-LIBRARIAN",
      "required_provenance": [
        "links to canonical status and contracts"
      ]
    },
    {
      "id": "knowledge_operations",
      "description": "Knowledge inventory, canonical ownership, freshness and contradiction handling",
      "canonical_path": "knowledge/profile.yaml",
      "human_projection_paths": [
        "docs/KNOWLEDGE-BASE.md",
        "governance/knowledge-registry.json"
      ],
      "classification_patterns": [
        "knowledge/**",
        "tools/kotodama_kb/**",
        "governance/knowledge-registry.json",
        "schemas/knowledge-registry.schema.json",
        "docs/KNOWLEDGE-BASE.md"
      ],
      "freshness": {
        "mode": "manual",
        "max_age_days": null,
        "severity": "info"
      },
      "owner_role": "AI-LIBRARIAN",
      "required_provenance": [
        "repository inventory",
        "canonical owner decisions"
      ]
    },
    {
      "id": "agent_portfolio",
      "description": "Candidate responsibility index and canonical role mapping; execution records belong to the existing lifecycle owner",
      "canonical_path": "governance/agent-registry.json",
      "human_projection_paths": [
        "docs/CONTROL-PLANE-AUDIT.md",
        "docs/PUBLIC-AGENT-LIFECYCLE-REGISTRY.md"
      ],
      "classification_patterns": [
        "governance/agent-registry.json",
        "schemas/agent-registry.schema.json",
        ".agents/skills/**"
      ],
      "freshness": {
        "mode": "json_field",
        "field": "reviewed_at",
        "max_age_days": 14,
        "severity": "warning"
      },
      "owner_role": "AI-AUDITOR",
      "required_provenance": [
        "eval evidence",
        "capability grants",
        "runtime evidence before activation"
      ]
    },
    {
      "id": "audit_policy",
      "description": "Automated audit cadence, findings, autonomy boundaries and optimization priority",
      "canonical_path": "governance/audit-policy.json",
      "human_projection_paths": [],
      "classification_patterns": [
        "governance/audit-policy.json",
        "schemas/audit-policy.schema.json",
        "tools/audit_control_plane.py",
        "tests/test_control_plane.py",
        ".github/workflows/control-plane-audit.yml"
      ],
      "freshness": {
        "mode": "json_field",
        "field": "reviewed_at",
        "max_age_days": 30,
        "severity": "warning"
      },
      "owner_role": "AI-AUDITOR",
      "required_provenance": [
        "audit findings",
        "policy decision"
      ]
    },
    {
      "id": "governance_contracts_and_templates",
      "description": "Schemas, Company Pack templates, governed records and navigation maps",
      "canonical_path": "schemas/company-manifest.schema.json",
      "human_projection_paths": [
        "docs/TEMPLATE-GUIDE.md"
      ],
      "classification_patterns": [
        "schemas/*.json",
        "templates/*",
        "templates/**/*",
        "migration/**",
        "architecture/**"
      ],
      "freshness": {
        "mode": "manual",
        "max_age_days": null,
        "severity": "info"
      },
      "owner_role": "AI-CHIEF",
      "required_provenance": [
        "schema validation",
        "regression tests"
      ]
    },
    {
      "id": "documentation_and_runbooks",
      "description": "Runbooks, review workflow, candidate contracts and operator documentation",
      "canonical_path": "docs/SCHEMA-VALIDATOR-MATRIX.md",
      "human_projection_paths": [],
      "classification_patterns": [
        "docs/*.md",
        "docs/**"
      ],
      "freshness": {
        "mode": "manual",
        "max_age_days": null,
        "severity": "info"
      },
      "owner_role": "AI-LIBRARIAN",
      "required_provenance": [
        "linked schema/tool/evidence"
      ]
    },
    {
      "id": "runtime_candidates",
      "description": "Runtime and deployment candidates; does not imply live deployment",
      "canonical_path": "runtime/compose-minimum/README.md",
      "human_projection_paths": [],
      "classification_patterns": [
        "runtime/*",
        "runtime/**/*",
        "governance/cloudflare-os-integration.json",
        "governance/openmaus-integration.json"
      ],
      "freshness": {
        "mode": "manual",
        "max_age_days": null,
        "severity": "info"
      },
      "owner_role": "AI-BUILDER",
      "required_provenance": [
        "runtime receipt before live claims"
      ]
    },
    {
      "id": "implementation_tools",
      "description": "Deterministic repository tooling and validators",
      "canonical_path": "tools/validate_template_pack.py",
      "human_projection_paths": [],
      "classification_patterns": [
        "tools/*.py",
        "tools/*.cs"
      ],
      "freshness": {
        "mode": "manual",
        "max_age_days": null,
        "severity": "info"
      },
      "owner_role": "AI-BUILDER",
      "required_provenance": [
        "tests",
        "closed output contract"
      ]
    },
    {
      "id": "verification_suite",
      "description": "Regression and contract tests",
      "canonical_path": "tests/test_validate_template_pack.py",
      "human_projection_paths": [],
      "classification_patterns": [
        "tests/*.py",
        "tests/fixtures/*",
        "tests/fixtures/**/*",
        "tests/node/*",
        "tests/*.md"
      ],
      "freshness": {
        "mode": "manual",
        "max_age_days": null,
        "severity": "info"
      },
      "owner_role": "AI-AUDITOR",
      "required_provenance": [
        "test result"
      ]
    },
    {
      "id": "examples_and_fixtures",
      "description": "Candidate examples, fixtures and public starter data",
      "canonical_path": "examples/company-starter/README.md",
      "human_projection_paths": [],
      "classification_patterns": [
        "examples/*",
        "examples/**/*"
      ],
      "freshness": {
        "mode": "manual",
        "max_age_days": null,
        "severity": "info"
      },
      "owner_role": "AI-LIBRARIAN",
      "required_provenance": [
        "schema-valid fixture"
      ]
    },
    {
      "id": "repository_configuration",
      "description": "Repository-level configuration and test dependency declaration",
      "canonical_path": "requirements-test.txt",
      "human_projection_paths": [],
      "classification_patterns": [
        ".gitattributes",
        ".gitignore",
        "requirements-test.txt",
        ".github/*",
        ".github/**/*",
        ".agents/**",
        ".codex/**",
        "requirements-*.txt",
        "AGENTS.md",
        "CONTRIBUTING.md",
        "CODE_OF_CONDUCT.md",
        "SECURITY.md",
        "SUPPORT.md",
        "CHANGELOG.md",
        "LICENSE",
        "LICENSE.*",
        "NOTICE",
        "NOTICE.*",
        "CONTEXT.md",
        "LICENSES/**"
      ],
      "freshness": {
        "mode": "manual",
        "max_age_days": null,
        "severity": "info"
      },
      "owner_role": "AI-BUILDER",
      "required_provenance": [
        "reviewed change"
      ]
    }
  ],
  "contradiction_policy": {
    "severity_1_examples": [